{
  "belief_id": "belief_ghost_4cuts",
  "proposition": "Market consensus expects four Fed rate cuts before Q4.",
  "cell_type": "fact",
  "source_agent": "macro_agent_v4",
  "source_trust_class": "model",
  "confidence": 0.40,
  "epistemic_status": "quarantined",
  "created_at": "2026-05-20T09:15:00Z",
  "evidence": {
    "refs": [],
    "evidence_score": 0.06,
    "chain_terminates_in_agent_content": true
  },
  "decay": {
    "model": "exponential",
    "half_life": "P14D",
    "effective_confidence": 0.11
  },
  "reality_check": {
    "truth_drift_score": 0.82,
    "drift_data_ref": "series:fed-funds-futures-implied-cuts",
    "last_reconciled_at": "2026-06-05T13:00:00Z"
  },
  "calibration": {
    "outcome": "refuted",
    "resolved_at": "2026-06-04T00:00:00Z",
    "calibration_weight": 0.41
  },
  "telemetry": {
    "otel_span_id": "a1b2c3d4e5f6a7b8"
  },
  "thread_id": "macro-research"
}
